study_id,year,doi,modalidad,title,stage_primary,stage_norm,q2_candidate_abstract,q2_candidate_terms,AI_task_type,notes_coding,integration_approach,integration_trace,decision_timing,decision_timing_trace,review_trace
231,2024,https://doi.org/10.1002/ar.25332,Imagen,Can lung airway geometry be used to predict autism? A preliminary machine learning-based study,Diagnosis,Diagnosis,,,Classification (ASD vs control / multi-class),,Feature extraction,Keyword rule matched feature extraction workflow,Pre-decision,Approach maps directly to pre-decision support,q2_abstract_bool=missing; q2_terms_bool=missing
234,2023,https://doi.org/10.1007/978-3-031-45389-2_18,Imagen,Classification of\&#xa0;Facial Images to\&#xa0;Assist in\&#xa0;the\&#xa0;Diagnosis of\&#xa0;Autism Spectrum Disorder: A Study on\&#xa0;the\&#xa0;Effect of\&#xa0;Face Detection and\&#xa0;Landmark Identification Algorithms,Diagnosis,Diagnosis,,,Classification (ASD vs control / multi-class),Algoritmo principal no explícito o fuera del codebook; Confirmar algoritmo principal en full-text,Second-reader decision support,Keyword rule matched second-reader decision support,In-decision,Second-reader pattern maps to in-decision support,q2_abstract_bool=missing; q2_terms_bool=missing
236,2025,https://doi.org/10.1038/s41598-025-97313-8,No especificado,Correlations between blood group and Rh factor in families and autism spectrum disorder: A comprehensive analysis,Not clear,Not specified,,,Classification (ASD vs control / multi-class),Análisis de grupos sanguíneos con regresión logística/ML no claramente central para una etapa clínica RQ1.,Second-reader decision support,Keyword rule matched second-reader decision support,In-decision,Second-reader pattern maps to in-decision support,stage_norm=Not specified; q2_abstract_bool=missing; q2_terms_bool=missing
237,2022,https://doi.org/10.1371/journal.pone.0269637,Audio · Voz,Cross-linguistic patterns of speech prosodic differences in autism: A machine learning study,Screening,Screening,,,Classification (ASD vs control / multi-class),Algoritmo principal no explícito o fuera del codebook; Confirmar algoritmo principal en full-text,Second-reader decision support,Keyword rule matched second-reader decision support,In-decision,Second-reader pattern maps to in-decision support,q2_abstract_bool=missing; q2_terms_bool=missing
240,2022,https://doi.org/10.1142/S0129065722500460,Imagen,Diagnosis of Autism Disorder Based on Deep Network Trained by Augmented EEG Signals,Diagnosis,Diagnosis,,,Classification (ASD vs control / multi-class),Se comparan varios modelos; se eligió el principal/mejor reportado,Second-reader decision support,Keyword rule matched second-reader decision support,In-decision,Second-reader pattern maps to in-decision support,q2_abstract_bool=missing; q2_terms_bool=missing
241,2018,https://doi.org/10.1016/j.nicl.2018.01.014,Señales fisiológicas,Differences in atypical resting-state effective connectivity distinguish autism from schizophrenia,Diagnosis,Diagnosis,,,Classification (ASD vs control / multi-class),,Second-reader decision support,Keyword rule matched second-reader decision support,In-decision,Second-reader pattern maps to in-decision support,q2_abstract_bool=missing; q2_terms_bool=missing
246,2021,https://doi.org/10.1016/B978-0-12-822822-7.00009-0,No especificado,Exploring tree-based machine learning methods to predict autism spectrum disorder,Screening,Screening,,,Prediction (time-to-event / prognosis),,Second-reader decision support,Keyword rule matched second-reader decision support,In-decision,Second-reader pattern maps to in-decision support,q2_abstract_bool=missing; q2_terms_bool=missing
249,2015,https://doi.org/10.1111/jon.12280,Imagen,Gray Matter Alterations in Young Children with Autism Spectrum Disorders: Comparing Morphometry at the Voxel and Regional Level,Diagnosis,Diagnosis,,,Classification (ASD vs control / multi-class),Algoritmo principal no explícito o fuera del codebook; Confirmar algoritmo principal en full-text,Second-reader decision support,Keyword rule matched second-reader decision support,In-decision,Second-reader pattern maps to in-decision support,q2_abstract_bool=missing; q2_terms_bool=missing
250,2022,https://doi.org/10.1016/j.compbiomed.2022.105854,Señales fisiológicas,Identification of Autism spectrum disorder based on a novel feature selection method and Variational Autoencoder,Diagnosis,Diagnosis,,,Classification (ASD vs control / multi-class),,Feature extraction,Keyword rule matched feature extraction workflow,Pre-decision,Approach maps directly to pre-decision support,q2_abstract_bool=missing; q2_terms_bool=missing
251,2023,https://doi.org/10.1038/s41398-023-02662-5,Señales fisiológicas,Integrative analysis of long noncoding RNAs dysregulation and synapse-associated ceRNA regulatory axes in autism,Diagnosis,Diagnosis,,,Classification (ASD vs control / multi-class),Análisis integrativo de lncRNA/ceRNA sin algoritmo de IA clínico principal claramente reportado.,Second-reader decision support,Keyword rule matched second-reader decision support,In-decision,Second-reader pattern maps to in-decision support,q2_abstract_bool=missing; q2_terms_bool=missing
253,2024,https://doi.org/10.1016/j.irbm.2024.100838,Señales fisiológicas,Interpersonal Motor Coordination in Children with Autism and the Establishment of Machine Learning Models to Objectively Classify Children with Autism and Typical Development,Screening,Screening,,,Classification (ASD vs control / multi-class),Algoritmo principal no explícito o fuera del codebook; Confirmar algoritmo principal en full-text,Second-reader decision support,Keyword rule matched second-reader decision support,In-decision,Second-reader pattern maps to in-decision support,q2_abstract_bool=missing; q2_terms_bool=missing
255,2025,https://doi.org/10.1109/TNSRE.2025.3580593,Señales fisiológicas,LSTA-CNN: A Lightweight Spatiotemporal Attention-Based Convolutional Neural Network for ASD Diagnosis Using EEG,Diagnosis,Diagnosis,,,Classification (ASD vs control / multi-class),Se comparan varios modelos; se eligió el principal/mejor reportado,Second-reader decision support,Keyword rule matched second-reader decision support,In-decision,Second-reader pattern maps to in-decision support,q2_abstract_bool=missing; q2_terms_bool=missing
258,2025,https://doi.org/10.1038/s41598-025-09862-7,Señales fisiológicas,MDNCT: a multi-domain neurocognitive transformer architecture approach for early prediction of autism spectrum disorders,Screening,Screening,,,Classification (ASD vs control / multi-class),Arquitectura transformer multi-domain para predicción temprana; fuente de datos específica no es explícita en el abstract.,Triage / questionnaires,Keyword rule matched triage/questionnaire workflow,Pre-decision,Approach maps directly to pre-decision support,q2_abstract_bool=missing; q2_terms_bool=missing
260,2024,https://doi.org/10.1007/978-981-99-8558-6_38,No especificado,Multi-atlas Representations Based on\&#xa0;Graph Convolutional Networks for\&#xa0;Autism Spectrum Disorder Diagnosis,Diagnosis,Diagnosis,,,Classification (ASD vs control / multi-class),Algoritmo principal no explícito o fuera del codebook; Confirmar algoritmo principal en full-text; Se comparan varios modelos; se eligió el principal/mejor reportado,Second-reader decision support,Keyword rule matched second-reader decision support,In-decision,Second-reader pattern maps to in-decision support,q2_abstract_bool=missing; q2_terms_bool=missing
266,2025,https://doi.org/10.1016/j.envint.2025.109562,No especificado,Prenatal exposure to criteria air pollution and traffic-related air toxics and risk of autism spectrum disorder: A population-based cohort study of California births (1990–2018),Not clear,Not specified,,,Other / Not clear,Algoritmo principal no explícito o fuera del codebook; Confirmar algoritmo principal en full-text,Risk stratification,Stage or keywords matched risk stratification,Pre-decision,Approach maps directly to pre-decision support,stage_norm=Not specified; q2_abstract_bool=missing; q2_terms_bool=missing
270,2020,https://doi.org/10.1016/j.medengphy.2020.07.004,Señales fisiológicas,Smart bed based daytime behavior prediction in Children with autism spectrum disorder - A Pilot Study,Monitoring/intervention,Monitoring/intervention,,,Prediction (time-to-event / prognosis),Predice conducta diurna a partir de señales BCG de smart bed; SVM y ANN comparados.,Adaptive intervention,Fallback assigned from monitoring/intervention stage,Post-decision,Approach maps directly to post-decision support,q2_abstract_bool=missing; q2_terms_bool=missing
271,2025,https://doi.org/10.1111/EXSY.13545,No especificado,Stakeholder perception towards a machine-learning-based digital platform for detection and management of autism spectrum disorder,Not clear,Not specified,,,Other / Not clear,Algoritmo principal no explícito o fuera del codebook; Resumen sugiere revisión/comentario/sistema no claramente empírico,Adaptive intervention,Keyword rule matched adaptive intervention workflow,Post-decision,Approach maps directly to post-decision support,stage_norm=Not specified; q2_abstract_bool=missing; q2_terms_bool=missing
273,2021,https://doi.org/10.1007/978-3-030-86993-9_36,No especificado,Towards autism subtype detection through identification of discriminatory factors using machine learning,Diagnosis,Diagnosis,,,Clustering / subtyping,Genera subtipos con k-means a partir de Q-CHAT/AQ-10; clasificadores posteriores son secundarios.,Triage / questionnaires,Keyword rule matched triage/questionnaire workflow,Pre-decision,Approach maps directly to pre-decision support,q2_abstract_bool=missing; q2_terms_bool=missing
274,2022,https://doi.org/10.3390/s22072528,Texto · NLP,‘IoT and AI-Based Application for Automatic Interpretation of the Affective State of Children Diagnosed with Autism,Monitoring/intervention,Monitoring/intervention,,,Classification (ASD vs control / multi-class),,Mobile screening,Keyword rule matched mobile screening workflow,Pre-decision,Approach maps directly to pre-decision support,q2_abstract_bool=missing; q2_terms_bool=missing
276,2014,https://doi.org/10.1016/j.eswa.2014.05.011,Señales fisiológicas,A situation-aware system for the detection of motion disorders of patients with Autism Spectrum Disorders,Monitoring/intervention,Monitoring/intervention,,,Detection / segmentation,Algoritmo principal no explícito o fuera del codebook; Confirmar algoritmo principal en full-text,Second-reader decision support,Keyword rule matched second-reader decision support,In-decision,Second-reader pattern maps to in-decision support,q2_abstract_bool=missing; q2_terms_bool=missing
277,2023,https://doi.org/10.1093/cercor/bhad125,Imagen,Accurate corresponding fiber tract segmentation via FiberGeoMap learner with application to autism,Diagnosis,Diagnosis,,,Detection / segmentation,Segmentación de tractos de difusión; algoritmo FiberGeoMap fuera del codebook.,Second-reader decision support,Keyword rule matched second-reader decision support,In-decision,Second-reader pattern maps to in-decision support,q2_abstract_bool=missing; q2_terms_bool=missing
278,2017,https://doi.org/10.1186/S12911-017-0564-8,Imagen,Autism risk classification using placental chorionic surface vascular network features,Prescreening,Prescreening,,,Classification (ASD vs control / multi-class),,Second-reader decision support,Keyword rule matched second-reader decision support,In-decision,Second-reader pattern maps to in-decision support,q2_abstract_bool=missing; q2_terms_bool=missing
279,2022,https://doi.org/10.1002/CPE.6498,No especificado,Autism spectrum disorder detection using sequential minimal optimization-support vector machine hybrid classifier according to history of jaundice and family autism in children,Diagnosis,Diagnosis,,,Classification (ASD vs control / multi-class),,Second-reader decision support,Keyword rule matched second-reader decision support,In-decision,Second-reader pattern maps to in-decision support,q2_abstract_bool=missing; q2_terms_bool=missing
280,2023,https://doi.org/10.1016/j.jneumeth.2023.109901,Multimodal,Classification of autism based on short-term spontaneous hemodynamic fluctuations using an adaptive graph neural network,Diagnosis,Diagnosis,,,Classification (ASD vs control / multi-class),Algoritmo principal no explícito o fuera del codebook; Confirmar algoritmo principal en full-text; Se comparan varios modelos; se eligió el principal/mejor reportado,Second-reader decision support,Keyword rule matched second-reader decision support,In-decision,Second-reader pattern maps to in-decision support,q2_abstract_bool=missing; q2_terms_bool=missing
281,2022,https://doi.org/10.3390/ijerph191912857,Imagen,Deep Mobile Linguistic Therapy for Patients with ASD,Monitoring/intervention,Monitoring/intervention,,,Other / Not clear,Sistema de terapia lingüística móvil; no corresponde a una tarea diagnóstica clásica.,Mobile screening,Keyword rule matched mobile screening workflow,Pre-decision,Approach maps directly to pre-decision support,q2_abstract_bool=missing; q2_terms_bool=missing
282,2023,https://doi.org/10.1186/s12859-023-05378-x,Texto · NLP,DeepASDPred: a CNN-LSTM-based deep learning method for Autism spectrum disorders risk RNA identification,Prescreening,Prescreening,,,Classification (ASD vs control / multi-class),Predicción de RNAs de riesgo ASD con arquitectura CNN-LSTM; se marca prescreening/risk.,Triage / questionnaires,Keyword rule matched triage/questionnaire workflow,Pre-decision,Approach maps directly to pre-decision support,q2_abstract_bool=missing; q2_terms_bool=missing
286,2022,https://doi.org/10.1111/EXSY.13040,Señales fisiológicas,Feedback Artificial Tree-Anti Corona Virus Optimization enabled deep learning for detecting autism spectrum disorder,Diagnosis,Diagnosis,,,Classification (ASD vs control / multi-class),fMRI con ROI extraction + deep residual network optimizada; se codifica CNN/DRN como algoritmo principal.,Second-reader decision support,Keyword rule matched second-reader decision support,In-decision,Second-reader pattern maps to in-decision support,q2_abstract_bool=missing; q2_terms_bool=missing
287,2020,https://doi.org/10.1038/s41598-020-61288-5,No especificado,Forecasting risk gene discovery in autism with machine learning and genome-scale data,Prescreening,Prescreening,,,Classification (ASD vs control / multi-class),Algoritmo principal no explícito o fuera del codebook; Confirmar algoritmo principal en full-text,Second-reader decision support,Keyword rule matched second-reader decision support,Pre-decision,Second-reader pattern was re-routed to pre-decision by text cue,q2_abstract_bool=missing; q2_terms_bool=missing
288,2022,https://doi.org/10.1007/s10803-021-05179-2,Señales fisiológicas,Identifying Autism with Head Movement Features by Implementing Machine Learning Algorithms,Screening,Screening,,,Classification (ASD vs control / multi-class),Algoritmo principal no explícito o fuera del codebook; Confirmar algoritmo principal en full-text,Second-reader decision support,Keyword rule matched second-reader decision support,In-decision,Second-reader pattern maps to in-decision support,q2_abstract_bool=missing; q2_terms_bool=missing
289,2019,https://doi.org/10.1016/j.neuro.2018.11.015,No especificado,Increased serum levels of macrophage migration inhibitory factor in autism spectrum disorders,Diagnosis,Diagnosis,,,Regression (score / severity / risk),Etapa clínica no clara,Risk stratification,Stage or keywords matched risk stratification,Pre-decision,Approach maps directly to pre-decision support,q2_abstract_bool=missing; q2_terms_bool=missing
292,2015,https://doi.org/10.1186/1755-8794-8-S1-S7,No especificado,Performance of case-control rare copy number variation annotation in classification of autism,Diagnosis,Diagnosis,,,Classification (ASD vs control / multi-class),Clasificación basada en rare CNV; conditional inference forest rinde mejor.,Second-reader decision support,Keyword rule matched second-reader decision support,In-decision,Second-reader pattern maps to in-decision support,q2_abstract_bool=missing; q2_terms_bool=missing
300,2024,https://doi.org/10.1007/978-3-031-62273-1_36,Señales fisiológicas,Application of Speech Signal for Early Screening of Children with Autism Spectrum Disorder,Screening,Screening,,,Classification (ASD vs control / multi-class),Abstract faltante; se codifica solo por el título y requiere verificación en full-text.,Second-reader decision support,Keyword rule matched second-reader decision support,In-decision,Second-reader pattern maps to in-decision support,q2_abstract_bool=missing; q2_terms_bool=missing
1,2025,https://doi.org/10.1109/ACCESS.2025.3586314,No especificado,A Clinically Interpretable Approach for Early Detection of Autism Using Machine Learning With Explainable AI,Prescreening,Prescreening,1.0,1.0,Classification (ASD vs control / multi-class),"“Comparative ML study: Naive Bayes, SVM, Random Forest; RF best; explainability via SHAP; 5-fold CV.”",Second-reader decision support,Keyword rule matched second-reader decision support,In-decision,Second-reader pattern maps to in-decision support,q2_abstract_bool=missing; q2_terms_bool=missing
4,2025,https://doi.org/10.1007/978-981-96-3942-7_18,No especificado,Cognitive Disorder Detection Used for Early Autism Screening Using Deep Learning,Diagnosis,Diagnosis,1.0,1.0,Classification (ASD vs control / multi-class),Classification task; target label not consistently described (cognitive disorder/MiCD vs ‘early autism screening,Second-reader decision support,Keyword rule matched second-reader decision support,In-decision,Second-reader pattern maps to in-decision support,q2_abstract_bool=missing; q2_terms_bool=missing
6,2017,https://doi.org/10.1186/s13229-017-0180-6,Imagen,Sparsifying machine learning models identify stable subsets of predictive features for behavioral detection of autism,Screening,Screening,0.0,0.0,Classification (ASD vs control / multi-class),Comparative study (17 supervised models); sparse/regularized; interpretable candidates include Logistic Regression (L2) and Linear SVM (L1).,Second-reader decision support,Keyword rule matched second-reader decision support,In-decision,Second-reader pattern maps to in-decision support,q2_abstract_bool=missing; q2_terms_bool=missing
8,2024,https://doi.org/10.3390/s24237489,Imagen,A Closed-Loop Ear-Worn Wearable EEG System with Real-Time Passive Electrode Skin Impedance Measurement for Early Autism Detection †,diagnosis,Diagnosis,0.0,0.0,Classification (ASD vs control / multi-class),,Second-reader decision support,Keyword rule matched second-reader decision support,In-decision,Second-reader pattern maps to in-decision support,q2_abstract_bool=missing; q2_terms_bool=missing
9,2019,https://doi.org/10.1016/j.csl.2018.11.002,Audio · Voz,An automated assessment framework for atypical prosody and stereotyped idiosyncratic phrases related to autism spectrum disorder,diagnosis,Diagnosis,0.0,0.0,Classification (ASD vs control / multi-class),"“End-to-end models: CNN, RNN(BLSTM), CNN+RNN(GRU/LSTM) on spectrograms; baseline OpenSMILE+linear SVM; text task uses linear SVM with n-gram/dep-treebank/TF-IDF/LIWC; score-level fusion.",Second-reader decision support,Keyword rule matched second-reader decision support,In-decision,Second-reader pattern maps to in-decision support,q2_abstract_bool=missing; q2_terms_bool=missing
10,2024,https://doi.org/10.1109/TAI.2024.3439288,Texto · NLP,Artificial Intelligence Driven Predictive Analysis of Acoustic and Linguistic Behaviors for ASD Identification,diagnosis,Diagnosis,1.0,1.0,Classification (binary/multi-class; incl. ASD vs control)/ multi-class),,Second-reader decision support,Keyword rule matched second-reader decision support,In-decision,Second-reader pattern maps to in-decision support,q2_abstract_bool=missing; q2_terms_bool=missing
11,2025,https://doi.org/10.2196/72115,Imagen,Data Mining-Based Model for Computer-Aided Diagnosis of Autism and Gelotophobia: Mixed Methods Deep Learning Approach.,diagnosis,Diagnosis,1.0,1.0,Classification (ASD vs control / multi-class),ASD status classification from facial images using DeepFace feature extraction; multiple ML models evaluated; MLP reported as highest test accuracy; gelotophobia assessed via DeepFace emotion analysis + GELOPH<15> questionnaire as confirmatory when facial cues ambiguous,Triage / questionnaires,Keyword rule matched triage/questionnaire workflow,Pre-decision,Approach maps directly to pre-decision support,q2_abstract_bool=missing; q2_terms_bool=missing
12,2019,https://doi.org/10.1001/jamapediatrics.2019.0285,Multimodal,Effect of Wearable Digital Intervention for Improving Socialization in Children with Autism Spectrum Disorder: A Randomized Clinical Trial,monitoring_intervention,Monitoring/intervention,1.0,1.0,Other,Wearable AI-driven behavioral intervention (‘Superpower Glass’) that detects facial expressions and provides cues for emotion recognition during home sessions; clinical RCT; AI model family not specified in paper text.,Mobile screening,Keyword rule matched mobile screening workflow,Pre-decision,Approach maps directly to pre-decision support,q2_abstract_bool=missing; q2_terms_bool=missing
15,2025,https://doi.org/10.1016/j.mex.2025.103278,Imagen,Hybrid CNN and random forest model with late fusion for detection of autism spectrum disorder in Toddlers,screening,Screening,0.0,0.0,Classification (binary/multi-class; incl. ASD vs control)/ multi-class),Hybrid late-fusion: VGG16 (CNN feature extractor) + Random Forest classifier; compares vs VGG16/EfficientNet/AlexNet and conventional ML,Triage / questionnaires,Keyword rule matched triage/questionnaire workflow,Pre-decision,Approach maps directly to pre-decision support,q2_abstract_bool=missing; q2_terms_bool=missing
16,2025,https://doi.org/10.1007/978-3-031-81083-1_7,No especificado,Machine Learning Approaches for the Early Diagnosis of Autism Spectrum Disorder: A Systematic Framework,screening,Screening,1.0,1.0,Not clear,,Adaptive intervention,Keyword rule matched adaptive intervention workflow,Post-decision,Approach maps directly to post-decision support,q2_abstract_bool=missing; q2_terms_bool=missing
17,2024,https://doi.org/10.1038/s41398-024-02802-5,Imagen,Machine learning classification of autism spectrum disorder based on reciprocity in naturalistic social interactions,diagnosis,Diagnosis,0.0,0.0,Classification (ASD vs control / multi-class),Naturalistic social interaction videos; open-source computer vision used for objective annotation (movement/facial expression synchrony); features fed into SVM model to classify autistic vs non-autistic interaction dyads; supplementary exploratory RF mentioned,Second-reader decision support,Keyword rule matched second-reader decision support,In-decision,Second-reader pattern maps to in-decision support,q2_abstract_bool=missing; q2_terms_bool=missing
20,2014,https://doi.org/10.1038/tp.2014.65,No especificado,Testing the accuracy of an observation-based classifier for rapid detection of autism risk.,screening,Screening,0.0,0.0,Classification (ASD vs control / multi-class),Algorithm specifically is Alternating Decision Tree (ADTree) (not a standard single CART/ID3); mapped to Decision Tree due to allowed categories,Second-reader decision support,Keyword rule matched second-reader decision support,In-decision,Second-reader pattern maps to in-decision support,q2_abstract_bool=missing; q2_terms_bool=missing
21,2024,https://doi.org/10.1038/s41598-024-81652-z,Señales fisiológicas,Using deep learning to classify developmental differences in reaching and placing movements in children with and without autism spectrum disorder,diagnosis,Diagnosis,0.0,0.0,Classification (binary/multi-class; incl. ASD vs control)/ multi-class),,Second-reader decision support,Keyword rule matched second-reader decision support,In-decision,Second-reader pattern maps to in-decision support,q2_abstract_bool=missing; q2_terms_bool=missing
22,2021,https://doi.org/10.3390/s21175822,Señales fisiológicas,A CNN deep local and global ASD classification approach with continuous wavelet transform using task-based FMRI,screening,Screening,1.0,1.0,Classification (binary/multi-class; incl. ASD vs control)/ multi-class),"Incluye clustering para ROI/selección dimensional y generan “brain map indicating ASD severity level”, pero el objetivo central del sistema es clasificación ASD vs TD con CNN.",Feature extraction,Keyword rule matched feature extraction workflow,Pre-decision,Approach maps directly to pre-decision support,q2_abstract_bool=missing; q2_terms_bool=missing
29,2025,https://doi.org/10.1016/j.bspc.2025.107737,Imagen,An intellectual autism spectrum disorder classification framework in healthcare industry using ViT-based adaptive deep learning model,screening,Screening,0.0,0.0,Classification (binary/multi-class; incl. ASD vs control)/ multi-class),Hybrid architecture includes ViT + (Adaptive Residual DenseNet) + LSTM; mapped to Transformer as primary component.,Feature extraction,Keyword rule matched feature extraction workflow,Pre-decision,Approach maps directly to pre-decision support,q2_abstract_bool=missing; q2_terms_bool=missing
30,2020,https://doi.org/10.1016/j.procs.2020.03.399,No especificado,Analysis and Detection of Autism Spectrum Disorder Using Machine Learning Techniques,screening,Screening,0.0,0.0,Classification (binary/multi-class; incl. ASD vs control)/ multi-class),"Comparan varios algoritmos (Naive Bayes, SVM, LR, KNN, NN y CNN); para tu columna AI_algorithm_main conviene poner CNN porque es el que señalan como mejor globalmente",Second-reader decision support,Keyword rule matched second-reader decision support,In-decision,Second-reader pattern maps to in-decision support,q2_abstract_bool=missing; q2_terms_bool=missing
