study_id,year,doi,modalidad,title,stage_primary,stage_norm,q2_candidate_abstract,q2_candidate_terms,AI_task_type,notes_coding,integration_approach,integration_trace,decision_timing,decision_timing_trace,review_trace
131,2016,https://doi.org/10.2196/jmir.5439,Texto · NLP,Online concerns of parents suspecting autism spectrum disorder in their child: Content analysis of signs and automated prediction of risk,Prescreening,Prescreening,,,Classification (ASD vs control / multi-class),,Second-reader decision support,Keyword rule matched second-reader decision support,In-decision,Second-reader pattern maps to in-decision support,q2_abstract_bool=missing; q2_terms_bool=missing
133,2022,https://doi.org/10.1038/s41598-022-21719-x,No especificado,A data driven machine learning approach to differentiate between autism spectrum disorder and attention-deficit/hyperactivity disorder based on the best-practice diagnostic instruments for autism,Diagnosis,Diagnosis,,,Classification (ASD vs control / multi-class),,Triage / questionnaires,Keyword rule matched triage/questionnaire workflow,Pre-decision,Approach maps directly to pre-decision support,q2_abstract_bool=missing; q2_terms_bool=missing
134,2021,https://doi.org/10.1016/B978-0-12-822822-7.00011-9,No especificado,A deep learning predictive classifier for autism screening and diagnosis,Screening,Screening,,,Classification (ASD vs control / multi-class),Algoritmo principal no explícito o fuera del codebook; Confirmar algoritmo principal en full-text; Se comparan varios modelos; se eligió el principal/mejor reportado,Feature extraction,Keyword rule matched feature extraction workflow,Pre-decision,Approach maps directly to pre-decision support,q2_abstract_bool=missing; q2_terms_bool=missing
135,2022,https://doi.org/10.1007/s10803-021-05141-2,Audio · Voz,A Deep Neural Network-Based Model for Screening Autism Spectrum Disorder Using the Quantitative Checklist for Autism in Toddlers (QCHAT),Screening,Screening,,,Classification (ASD vs control / multi-class),Algoritmo principal no explícito o fuera del codebook; Confirmar algoritmo principal en full-text,Triage / questionnaires,Keyword rule matched triage/questionnaire workflow,Pre-decision,Approach maps directly to pre-decision support,q2_abstract_bool=missing; q2_terms_bool=missing
137,2021,https://doi.org/10.1177/1460458221991882,Imagen,Applying machine learning on home videos for remote autism diagnosis: Further study and analysis,Screening,Screening,,,Classification (ASD vs control / multi-class),Algoritmo principal no explícito o fuera del codebook; Confirmar algoritmo principal en full-text,Feature extraction,Keyword rule matched feature extraction workflow,Pre-decision,Approach maps directly to pre-decision support,q2_abstract_bool=missing; q2_terms_bool=missing
138,2024,https://doi.org/10.1038/s41598-024-64299-8,No especificado,ASD-SWNet: a novel shared-weight feature extraction and classification network for autism spectrum disorder diagnosis,Diagnosis,Diagnosis,,,Classification (ASD vs control / multi-class),,Feature extraction,Keyword rule matched feature extraction workflow,Pre-decision,Approach maps directly to pre-decision support,q2_abstract_bool=missing; q2_terms_bool=missing
139,2025,https://doi.org/10.1007/978-981-96-6297-5_20,No especificado,Assessing the Efficacy of Deep Learning Algorithms for Behavioral and Neurological Markers in Autism Diagnosis in Children,Diagnosis,Diagnosis,,,Classification (ASD vs control / multi-class),El abstract no deja claro si es evaluación empírica o revisión de marcadores conductuales/neurológicos.,Feature extraction,Keyword rule matched feature extraction workflow,Pre-decision,Approach maps directly to pre-decision support,q2_abstract_bool=missing; q2_terms_bool=missing
142,2025,https://doi.org/10.1109/JBHI.2025.3542066,Imagen,AV-FOS: Transformer-Based Audio-Visual Multimodal Interaction Style Recognition for Children With Autism Using the Revised Family Observation Schedule 3rd Edition (FOS-R-III),Monitoring/intervention,Monitoring/intervention,,,Classification (ASD vs control / multi-class),Reconocimiento de estilo de interacción audio-visual en FOS-R-III; etapa clínica exacta requiere confirmación.,Second-reader decision support,Keyword rule matched second-reader decision support,In-decision,Second-reader pattern maps to in-decision support,q2_abstract_bool=missing; q2_terms_bool=missing
143,2023,https://doi.org/10.1186/S12920-023-01439-5,No especificado,Biomarker prediction in autism spectrum disorder using a network-based approach,Diagnosis,Diagnosis,,,Other / Not clear,Algoritmo principal no explícito o fuera del codebook; Confirmar algoritmo principal en full-text,Adaptive intervention,Keyword rule matched adaptive intervention workflow,Post-decision,Approach maps directly to post-decision support,q2_abstract_bool=missing; q2_terms_bool=missing
144,2024,https://doi.org/10.1038/s41598-024-56098-y,Imagen,Classifying autism in a clinical population based on motion synchrony: a proof-of-concept study using real-life diagnostic interviews,Diagnosis,Diagnosis,,,Classification (ASD vs control / multi-class),,Second-reader decision support,Keyword rule matched second-reader decision support,In-decision,Second-reader pattern maps to in-decision support,q2_abstract_bool=missing; q2_terms_bool=missing
146,2022,https://doi.org/10.1186/S12911-022-02050-X,No especificado,Comparison of classification algorithms for predicting autistic spectrum disorder using WEKA modeler,Screening,Screening,,,Classification (ASD vs control / multi-class),Se comparan varios modelos; se eligió el principal/mejor reportado,Second-reader decision support,Keyword rule matched second-reader decision support,In-decision,Second-reader pattern maps to in-decision support,q2_abstract_bool=missing; q2_terms_bool=missing
147,2025,https://doi.org/10.1109/TCSS.2025.3593119,Multimodal,DALNN: Dual Attention Learning Neural Network for Diagnosis of Autism Spectrum Disorders and Exploration of Lesion Brain Regions,Diagnosis,Diagnosis,,,Classification (ASD vs control / multi-class),Algoritmo principal no explícito o fuera del codebook; Confirmar algoritmo principal en full-text,Feature extraction,Keyword rule matched feature extraction workflow,Pre-decision,Approach maps directly to pre-decision support,q2_abstract_bool=missing; q2_terms_bool=missing
149,2021,https://doi.org/10.1176/appi.ajp.2020.19101091,Multimodal,Diagnostic classification for human autism and obsessive-compulsive disorder based on machine learning from a primate genetic model,Diagnosis,Diagnosis,,,Classification (ASD vs control / multi-class),Clasificación diagnóstica basada en modelo genético de primates; confirmar fuente biológica exacta.,Second-reader decision support,Keyword rule matched second-reader decision support,In-decision,Second-reader pattern maps to in-decision support,q2_abstract_bool=missing; q2_terms_bool=missing
150,2021,https://doi.org/10.1111/JCPP.13406,Señales fisiológicas,Diagnostic shifts in autism spectrum disorder can be linked to the fuzzy nature of the diagnostic boundary: a data-driven approach,Diagnosis,Diagnosis,,,Classification (ASD vs control / multi-class),Algoritmo principal no explícito o fuera del codebook; Confirmar algoritmo principal en full-text; Se comparan varios modelos; se eligió el principal/mejor reportado,Second-reader decision support,Keyword rule matched second-reader decision support,In-decision,Second-reader pattern maps to in-decision support,q2_abstract_bool=missing; q2_terms_bool=missing
156,2021,https://doi.org/10.1109/ACCESS.2021.3069211,Imagen,Exploring sMRI Biomarkers for Diagnosis of Autism Spectrum Disorders Based on Multi Class Activation Mapping Models,Diagnosis,Diagnosis,,,Classification (ASD vs control / multi-class),Algoritmo principal no explícito o fuera del codebook; Confirmar algoritmo principal en full-text,Triage / questionnaires,Keyword rule matched triage/questionnaire workflow,Pre-decision,Approach maps directly to pre-decision support,q2_abstract_bool=missing; q2_terms_bool=missing
158,2022,https://doi.org/10.1007/978-3-031-13844-7_33,No especificado,Graph Convolutional Networks Based on\&#xa0;Relational Attention Mechanism for\&#xa0;Autism Spectrum Disorders Diagnosis,Diagnosis,Diagnosis,,,Classification (ASD vs control / multi-class),Algoritmo principal no explícito o fuera del codebook; Confirmar algoritmo principal en full-text; Se comparan varios modelos; se eligió el principal/mejor reportado,Second-reader decision support,Keyword rule matched second-reader decision support,In-decision,Second-reader pattern maps to in-decision support,q2_abstract_bool=missing; q2_terms_bool=missing
161,2025,https://doi.org/10.1038/s41598-025-96014-6,Imagen,Leveraging artificial intelligence for diagnosis of children autism through facial expressions,Screening,Screening,,,Classification (ASD vs control / multi-class),Diagnóstico por expresiones faciales; abstract no especifica claramente una arquitectura del codebook.,Mobile screening,Keyword rule matched mobile screening workflow,Pre-decision,Approach maps directly to pre-decision support,q2_abstract_bool=missing; q2_terms_bool=missing
163,2020,https://doi.org/10.1155/2020/1357853,Imagen,Multichannel Deep Attention Neural Networks for the Classification of Autism Spectrum Disorder Using Neuroimaging and Personal Characteristic Data,Diagnosis,Diagnosis,,,Classification (ASD vs control / multi-class),Algoritmo principal no explícito o fuera del codebook; Confirmar algoritmo principal en full-text,Second-reader decision support,Keyword rule matched second-reader decision support,In-decision,Second-reader pattern maps to in-decision support,q2_abstract_bool=missing; q2_terms_bool=missing
166,2020,https://doi.org/10.1108/LHT-08-2019-0176,Imagen,Research and development of autism diagnosis information system based on deep convolution neural network and facial expression data,Screening,Screening,,,Classification (ASD vs control / multi-class),,Second-reader decision support,Keyword rule matched second-reader decision support,In-decision,Second-reader pattern maps to in-decision support,q2_abstract_bool=missing; q2_terms_bool=missing
168,2023,https://doi.org/10.1145/3539226,Imagen,Stratification of Children with Autism Spectrum Disorder Through Fusion of Temporal Information in Eye-gaze Scan-Paths,Diagnosis,Diagnosis,,,Classification (ASD vs control / multi-class),Estratificación de niños con ASD usando trayectorias de eye-gaze; confirmar si el objetivo es subtipado vs clasificación.,Triage / questionnaires,Keyword rule matched triage/questionnaire workflow,Pre-decision,Approach maps directly to pre-decision support,q2_abstract_bool=missing; q2_terms_bool=missing
169,2022,https://doi.org/10.2196/33771,Imagen,The Classification of Abnormal Hand Movement to Aid in Autism Detection: Machine Learning Study,Screening,Screening,,,Classification (ASD vs control / multi-class),,Mobile screening,Keyword rule matched mobile screening workflow,Pre-decision,Approach maps directly to pre-decision support,q2_abstract_bool=missing; q2_terms_bool=missing
170,2020,https://doi.org/10.2196/15767,Imagen,The development of a practical artificial intelligence tool for diagnosing and evaluating autism spectrum disorder: Multicenter study,Diagnosis,Diagnosis,,,Classification (ASD vs control / multi-class),Algoritmo principal no explícito o fuera del codebook; Confirmar algoritmo principal en full-text; Se comparan varios modelos; se eligió el principal/mejor reportado,Feature extraction,Keyword rule matched feature extraction workflow,Pre-decision,Approach maps directly to pre-decision support,q2_abstract_bool=missing; q2_terms_bool=missing
171,2016,https://doi.org/10.1038/srep31107,Señales fisiológicas,Toward the Autism Motor Signature: Gesture patterns during smart tablet gameplay identify children with autism,Screening,Screening,,,Classification (ASD vs control / multi-class),Algoritmo principal no explícito o fuera del codebook; Confirmar algoritmo principal en full-text,Second-reader decision support,Keyword rule matched second-reader decision support,In-decision,Second-reader pattern maps to in-decision support,q2_abstract_bool=missing; q2_terms_bool=missing
173,2023,https://doi.org/10.1111/JCPP.13650,Texto · NLP,Using machine learning to improve diagnostic assessment of ASD in the light of specific differential and co-occurring diagnoses,Diagnosis,Diagnosis,,,Classification (ASD vs control / multi-class),Se comparan varios modelos; se eligió el principal/mejor reportado,Second-reader decision support,Keyword rule matched second-reader decision support,In-decision,Second-reader pattern maps to in-decision support,q2_abstract_bool=missing; q2_terms_bool=missing
174,2023,https://doi.org/10.3233/SHTI230734,Imagen,A Framework to Diagnose Autism Spectrum Disorder Using Morphological Connectivity of sMRI and XGBoost,Diagnosis,Diagnosis,,,Classification (ASD vs control / multi-class),,Second-reader decision support,Keyword rule matched second-reader decision support,In-decision,Second-reader pattern maps to in-decision support,q2_abstract_bool=missing; q2_terms_bool=missing
175,2023,https://doi.org/10.1038/s41598-023-40073-0,No especificado,A machine learning approach for understanding the metabolomics response of children with autism spectrum disorder to medical cannabis treatment,Monitoring/intervention,Monitoring/intervention,,,Other / Not clear,Algoritmo principal no explícito o fuera del codebook; Confirmar algoritmo principal en full-text,Adaptive intervention,Fallback assigned from monitoring/intervention stage,Post-decision,Approach maps directly to post-decision support,q2_abstract_bool=missing; q2_terms_bool=missing
177,2024,https://doi.org/10.1007/978-981-99-8141-0_12,No especificado,Aided Diagnosis of\&#xa0;Autism Spectrum Disorder Based on\&#xa0;a\&#xa0;Mixed Neural Network Model,Diagnosis,Diagnosis,,,Classification (ASD vs control / multi-class),Se comparan varios modelos; se eligió el principal/mejor reportado,Triage / questionnaires,Keyword rule matched triage/questionnaire workflow,Pre-decision,Approach maps directly to pre-decision support,q2_abstract_bool=missing; q2_terms_bool=missing
179,2019,https://doi.org/10.2174/2666082215666191111121115,Imagen,Autism spectrum disorder detection with machine learning methods,Screening,Screening,,,Classification (ASD vs control / multi-class),,Second-reader decision support,Keyword rule matched second-reader decision support,In-decision,Second-reader pattern maps to in-decision support,q2_abstract_bool=missing; q2_terms_bool=missing
180,2024,https://doi.org/10.1016/j.compbiomed.2024.108194,Señales fisiológicas,Biosignal comparison for autism assessment using machine learning models and virtual reality,Screening,Screening,,,Classification (ASD vs control / multi-class),Se comparan varios modelos; se eligió el principal/mejor reportado,Second-reader decision support,Keyword rule matched second-reader decision support,In-decision,Second-reader pattern maps to in-decision support,q2_abstract_bool=missing; q2_terms_bool=missing
184,2021,https://doi.org/10.1016/j.bpsc.2020.09.001,Imagen,Computerized Assessment of Motor Imitation as a Scalable Method for Distinguishing Children With Autism,Screening,Screening,,,Classification (ASD vs control / multi-class),Algoritmo principal no explícito o fuera del codebook; Confirmar algoritmo principal en full-text; Se comparan varios modelos; se eligió el principal/mejor reportado,Second-reader decision support,Keyword rule matched second-reader decision support,In-decision,Second-reader pattern maps to in-decision support,q2_abstract_bool=missing; q2_terms_bool=missing
185,2025,https://doi.org/10.1016/j.procs.2025.05.032,Imagen,Construction of ASD Intervention System Based On Neural Network Model,Monitoring/intervention,Monitoring/intervention,,,Classification (ASD vs control / multi-class),,Second-reader decision support,Keyword rule matched second-reader decision support,In-decision,Second-reader pattern maps to in-decision support,q2_abstract_bool=missing; q2_terms_bool=missing
186,2024,https://doi.org/10.1016/j.jneumeth.2024.110100,Señales fisiológicas,Decoding Autism: Uncovering patterns in brain connectivity through sparsity analysis with rs-fMRI data,Diagnosis,Diagnosis,,,Classification (ASD vs control / multi-class),Algoritmo principal no explícito o fuera del codebook; Confirmar algoritmo principal en full-text; Se comparan varios modelos; se eligió el principal/mejor reportado,Feature extraction,Keyword rule matched feature extraction workflow,Pre-decision,Approach maps directly to pre-decision support,q2_abstract_bool=missing; q2_terms_bool=missing
188,2020,https://doi.org/10.3390/s20236762,Audio · Voz,Deep-learning-based detection of infants with autism spectrum disorder using auto-encoder feature representation,Screening,Screening,,,Classification (ASD vs control / multi-class),Autoencoder para detección en infantes; confirmar fuente de datos exacta (no totalmente explícita en el abstract).,Feature extraction,Keyword rule matched feature extraction workflow,Pre-decision,Approach maps directly to pre-decision support,q2_abstract_bool=missing; q2_terms_bool=missing
189,2024,https://doi.org/10.1016/j.jad.2024.04.049,Imagen,Early identification of autism spectrum disorder based on machine learning with eye-tracking data,Screening,Screening,,,Classification (ASD vs control / multi-class),Se comparan varios modelos; se eligió el principal/mejor reportado,Second-reader decision support,Keyword rule matched second-reader decision support,In-decision,Second-reader pattern maps to in-decision support,q2_abstract_bool=missing; q2_terms_bool=missing
197,2022,https://doi.org/10.1155/2022/9410222,Texto · NLP,Hybrid Diagnosis Models for Autism Patients Based on Medical and Sociodemographic Features Using Machine Learning and Multicriteria Decision-Making (MCDM) Techniques: An Evaluation and Benchmarking Framework,Diagnosis,Diagnosis,,,Classification (ASD vs control / multi-class),Algoritmo principal no explícito o fuera del codebook; Confirmar algoritmo principal en full-text; Se comparan varios modelos; se eligió el principal/mejor reportado,Feature extraction,Keyword rule matched feature extraction workflow,Pre-decision,Approach maps directly to pre-decision support,q2_abstract_bool=missing; q2_terms_bool=missing
198,2025,https://doi.org/10.1088/1742-6596/1921/1/012006/META,No especificado,Identification of autism spectrum disorder using deep neural network,Not clear,Not specified,,,Other / Not clear,Parece revisión de métodos/diagnósticos digitales más que estudio empírico primario.,Second-reader decision support,Keyword rule matched second-reader decision support,In-decision,Second-reader pattern maps to in-decision support,stage_norm=Not specified; q2_abstract_bool=missing; q2_terms_bool=missing
200,2024,https://doi.org/10.1007/s11042-024-18519-y,No especificado,Machine learning based autism screening tool—a modified approach,Screening,Screening,,,Classification (ASD vs control / multi-class),,Second-reader decision support,Keyword rule matched second-reader decision support,In-decision,Second-reader pattern maps to in-decision support,q2_abstract_bool=missing; q2_terms_bool=missing
201,2025,https://doi.org/10.1155/ACIS/9975499,Señales fisiológicas,Machine Learning–Based Approach for Early Screening of Autism Spectrum Disorders,Screening,Screening,,,Classification (ASD vs control / multi-class),Se comparan varios modelos; se eligió el principal/mejor reportado,Feature extraction,Keyword rule matched feature extraction workflow,Pre-decision,Approach maps directly to pre-decision support,q2_abstract_bool=missing; q2_terms_bool=missing
202,2024,https://doi.org/10.1038/s41598-024-76659-5,Señales fisiológicas,Model selection to achieve reproducible associations between resting state EEG features and autism,Diagnosis,Diagnosis,,,Classification (ASD vs control / multi-class),Algoritmo principal no explícito o fuera del codebook; Confirmar algoritmo principal en full-text,Second-reader decision support,Keyword rule matched second-reader decision support,In-decision,Second-reader pattern maps to in-decision support,q2_abstract_bool=missing; q2_terms_bool=missing
205,2024,https://doi.org/10.1109/JBHI.2024.3455942,Imagen,Off-Body Sleep Analysis for Predicting Adverse Behavior in Individuals With Autism Spectrum Disorder,Monitoring/intervention,Monitoring/intervention,,,Prediction (time-to-event / prognosis),Algoritmo principal no explícito o fuera del codebook; Confirmar algoritmo principal en full-text,Risk stratification,Stage or keywords matched risk stratification,Pre-decision,Approach maps directly to pre-decision support,q2_abstract_bool=missing; q2_terms_bool=missing
209,2024,https://doi.org/10.1016/j.pscychresns.2024.111822,Multimodal,Predicting individual autistic symptoms for patients with autism spectrum disorder using interregional morphological connectivity,Monitoring/intervention,Monitoring/intervention,,,Regression (score / severity / risk),Algoritmo principal no explícito o fuera del codebook; Confirmar algoritmo principal en full-text,Feature extraction,Keyword rule matched feature extraction workflow,Pre-decision,Approach maps directly to pre-decision support,q2_abstract_bool=missing; q2_terms_bool=missing
210,2023,https://doi.org/10.1016/j.bpsc.2021.08.009,Señales fisiológicas,Prediction of Behavioral Improvement Through Resting-State Electroencephalography and Clinical Severity in a Randomized Controlled Trial Testing Bumetanide in Autism Spectrum Disorder,Monitoring/intervention,Monitoring/intervention,,,Prediction (time-to-event / prognosis),Algoritmo principal no explícito o fuera del codebook; Confirmar algoritmo principal en full-text,Adaptive intervention,Fallback assigned from monitoring/intervention stage,Post-decision,Approach maps directly to post-decision support,q2_abstract_bool=missing; q2_terms_bool=missing
213,2015,https://doi.org/10.1016/j.cortex.2014.08.011,Señales fisiológicas,Resting state functional magnetic resonance imaging and neural network classified autism and control,Diagnosis,Diagnosis,,,Classification (ASD vs control / multi-class),Algoritmo principal no explícito o fuera del codebook; Confirmar algoritmo principal en full-text,Second-reader decision support,Keyword rule matched second-reader decision support,In-decision,Second-reader pattern maps to in-decision support,q2_abstract_bool=missing; q2_terms_bool=missing
218,2022,https://doi.org/10.1007/s13042-022-01554-2,Imagen,Using a small dataset to classify strength-interactions with an elastic display: a case study for the screening of autism spectrum disorder,Screening,Screening,,,Classification (ASD vs control / multi-class),Algoritmo principal no explícito o fuera del codebook; Confirmar algoritmo principal en full-text,Second-reader decision support,Keyword rule matched second-reader decision support,In-decision,Second-reader pattern maps to in-decision support,q2_abstract_bool=missing; q2_terms_bool=missing
221,2023,https://doi.org/10.1186/S12859-023-05501-Y,No especificado,A hybrid Stacking-SMOTE model for optimizing the prediction of autistic genes,Diagnosis,Diagnosis,,,Prediction (time-to-event / prognosis),Algoritmo principal no explícito o fuera del codebook; Confirmar algoritmo principal en full-text,Risk stratification,Stage or keywords matched risk stratification,Pre-decision,Approach maps directly to pre-decision support,q2_abstract_bool=missing; q2_terms_bool=missing
222,2021,https://doi.org/10.1002/AUR.2595,Imagen,An amygdala-centered hyper-connectivity signature of threatening face processing predicts anxiety in youths with autism spectrum conditions,Monitoring/intervention,Monitoring/intervention,,,Prediction (time-to-event / prognosis),Usa fMRI de procesamiento de amenaza para predecir ansiedad en jóvenes con ASC.,Adaptive intervention,Fallback assigned from monitoring/intervention stage,Post-decision,Approach maps directly to post-decision support,q2_abstract_bool=missing; q2_terms_bool=missing
225,2019,https://doi.org/10.1007/s10803-018-3690-y,Imagen,Applying Eye Tracking to Identify Autism Spectrum Disorder in Children,Screening,Screening,,,Classification (ASD vs control / multi-class),Algoritmo principal no explícito o fuera del codebook; Confirmar algoritmo principal en full-text,Second-reader decision support,Keyword rule matched second-reader decision support,In-decision,Second-reader pattern maps to in-decision support,q2_abstract_bool=missing; q2_terms_bool=missing
226,2023,https://doi.org/10.1016/j.compeleceng.2023.108720,Imagen,Artificial intelligence and sensor-based autism spectrum disorder diagnosis using brain connectivity analysis,Diagnosis,Diagnosis,,,Classification (ASD vs control / multi-class),Algoritmo principal no explícito o fuera del codebook; Confirmar algoritmo principal en full-text,Second-reader decision support,Keyword rule matched second-reader decision support,In-decision,Second-reader pattern maps to in-decision support,q2_abstract_bool=missing; q2_terms_bool=missing
230,2024,https://doi.org/10.1007/978-3-031-72069-7_6,Señales fisiológicas,BrainWaveNet: Wavelet-based Transformer for Autism Spectrum Disorder Diagnosis,Diagnosis,Diagnosis,,,Classification (ASD vs control / multi-class),,Second-reader decision support,Keyword rule matched second-reader decision support,In-decision,Second-reader pattern maps to in-decision support,q2_abstract_bool=missing; q2_terms_bool=missing
